node_1|node_2|edge|chunk_id
management tips|harvard business review|Book Title and Author|04b358ab22804a7fb7f3f1e29b5a4c07
empower your employees|leadership skills|Leaders can empower their employees by giving responsibility and autonomy, focusing on growth, and avoiding second-guessing. This is important for successful leadership.|04b358ab22804a7fb7f3f1e29b5a4c07
give responsibility and autonomy|delegation|Giving responsibility and autonomy to those who demonstrate capacity to handle it helps empower employees by allowing them to take ownership of their tasks and resources.|04b358ab22804a7fb7f3f1e29b5a4c07
focus on growth|employee development|Creating an environment for skill expansion and rewarding growth empowers employees by fostering their development.|04b358ab22804a7fb7f3f1e29b5a4c07
don't second-guess|trust|Avoid doubting others' decisions unless absolutely necessary to maintain their confidence. This shows trust in your employees and empowers them to take ownership of their tasks.|04b358ab22804a7fb7f3f1e29b5a4c07
speak effectively in sales|sales techniques|This concept is not directly related to the empowerment of employees, but it still falls under leadership skills and effective communication in a sales context.|04b358ab22804a7fb7f3f1e29b5a4c07
effectively communicating with customers|understanding their language|Tailor approach and language for each customer, recognize customers' unique language|7dd8df94c5e54f78abab1d920aafd0c7
effectively communicating with customers|focusing on them|Talk about customers' problems, values, and purchasing plans. Avoid talking about your company, product benefits, or features.|7dd8df94c5e54f78abab1d920aafd0c7
understanding their language|avoiding one-size-fits-all sales pitch|Recognize customers' unique language|7dd8df94c5e54f78abab1d920aafd0c7
focusing on them|turning spotlight on customers|Talk about customers' problems, values, and purchasing plans. Avoid talking about your company, product benefits, or features.|7dd8df94c5e54f78abab1d920aafd0c7
innovate with less|large corporations|Even large corporations need to innovate as start-ups do when resources and time become scarce|b8345e6fa6ef45c587ff54d179452dd0
innovation|big budget|Forget the big budget: Innovation doesn't have to cost a lot|b8345e6fa6ef45c587ff54d179452dd0
open-source software|large corporations|Use open-source software, online research tools, and virtual prototypes in large corporations for innovation|b8345e6fa6ef45c587ff54d179452dd0
online market research tools|large corporations|Use open-source software, online research tools, and virtual prototypes in large corporations for innovation|b8345e6fa6ef45c587ff54d179452dd0
virtual prototypes|large corporations|Use open-source software, online research tools, and virtual prototypes in large corporations for innovation|b8345e6fa6ef45c587ff54d179452dd0
real market|ideas|Test ideas cheaply in the real market|b8345e6fa6ef45c587ff54d179452dd0
good enough design|ideas|Get a 'good enough' design out there, then test and refine in the market|b8345e6fa6ef45c587ff54d179452dd0
planning every detail|idea|Don't be afraid to wind down ideas when they start to fail instead of wasting time endlessly perfecting ideas before launch|b8345e6fa6ef45c587ff54d179452dd0
quick decision making|tough times|Making decisions and move on: Tough times require quick decision making|b8345e6fa6ef45c587ff54d179452dd0
stress|harmful stress reactions|Unhealthy stress reactions include micromanaging, making heavy-handed suggestions, and second-guessing decisions.|4544f0dcd0ea4777b19e5f7ebf2d1b72
stress|productive stress responses|Identify your reaction to stress. Productive stress responses include cleaning or checking in with team.|4544f0dcd0ea4777b19e5f7ebf2d1b72
user's notes|user's notes|Common reactions to stress are micromanaging, making heavy-handed suggestions, and second-guessing decisions. Pause and take a breath when noticing unhealthy reactions. Paying careful attention to your behavior can help stop harmful stress reactions.|4544f0dcd0ea4777b19e5f7ebf2d1b72
user's notes|note title|Note Title Manage Stress by Facing It summarizes the user's notes on managing stress by facing it.|4544f0dcd0ea4777b19e5f7ebf2d1b72
knowledge|intuition|Leaders gather abundance of information and conduct in-depth analyses, but too much knowledge can take away your power. The user's notes highlight the balance between knowledge and intuition in decision-making, emphasizing the potential pitfalls of over-analysis. This illustrates the relationship between knowledge and intuition, where intuition serves as a counterbalance to prevent analysis paralysis.|f30dbff58a124de49d72e5750cebf86d
past experiences|gut feelings|The notes also note the importance of past experiences and gut feelings. This indicates that past experiences can inform gut feelings, as they serve as a basis for decision-making. The relationship between past experiences and gut feelings is one where past experiences provide context for gut feelings.|f30dbff58a124de49d72e5750cebf86d
information|answers|The notes also touch upon the potential pitfalls of over-analysis, which results in analysis paralysis or data-driven but illogical answers. This indicates that information can lead to answers, but too much information can result in illogical outcomes. The relationship between information and answers is one where answers are derived from information.|f30dbff58a124de49d72e5750cebf86d
